{
  "$schema": "https://json-schema.org/draft/2020-12/schema",
  "$id": "https://github.com/serge-sotnyk/irServe/tools/probe/cases/_schema.json",
  "title": "Probe case",
  "description": "Declarative probe against the pinned vercel/serve reference. Each probe spawns a fresh serve instance against an inline fixture and runs an ordered list of HTTP requests.",
  "type": "object",
  "required": ["requests"],
  "additionalProperties": false,
  "properties": {
    "id": {
      "type": "string",
      "description": "Probe id. Optional; defaults to the file name without extension."
    },
    "description": {
      "type": "string",
      "description": "Free-form prose displayed in the result report."
    },
    "fixture": {
      "type": "object",
      "additionalProperties": false,
      "properties": {
        "files": {
          "type": "object",
          "description": "Map of fixture-relative path to file content. Strings are written as utf-8; objects with a base64 field are written as binary.",
          "additionalProperties": {
            "oneOf": [
              { "type": "string" },
              {
                "type": "object",
                "required": ["base64"],
                "additionalProperties": false,
                "properties": {
                  "base64": { "type": "string" }
                }
              }
            ]
          }
        },
        "serveJson": {
          "type": "object",
          "description": "Optional serve.json contents. Written verbatim into <fixture>/serve.json before the server starts."
        }
      }
    },
    "serveArgs": {
      "type": "array",
      "description": "Extra command-line arguments passed to `node third_party/serve/build/main.js` after the runner's own --listen / --no-clipboard / --no-port-switching.",
      "items": { "type": "string" }
    },
    "requests": {
      "type": "array",
      "minItems": 1,
      "items": {
        "type": "object",
        "required": ["name", "path"],
        "additionalProperties": false,
        "properties": {
          "name": {
            "type": "string",
            "description": "Stable identifier of this request within the probe (used as a section heading in the report)."
          },
          "method": {
            "type": "string",
            "description": "HTTP method. Defaults to GET.",
            "default": "GET"
          },
          "path": {
            "type": "string",
            "description": "Request path. Must include the leading slash. Use percent-encoded characters as-is."
          },
          "headers": {
            "type": "object",
            "description": "Request headers, name → value.",
            "additionalProperties": { "type": "string" }
          },
          "body": {
            "type": "string",
            "description": "Optional request body."
          },
          "redirect": {
            "type": "string",
            "enum": ["manual", "follow"],
            "description": "How fetch handles redirects. Default 'manual' (so the runner records the 301/302 itself rather than chasing it). Ignored when mode is 'raw'."
          },
          "mode": {
            "type": "string",
            "enum": ["fetch", "raw"],
            "description": "Request transport. 'fetch' (default) uses Node's fetch and may normalize the URL path (collapsing '..', decoding '%2e%2e', collapsing '//'). 'raw' opens a net.Socket and sends the literal request line bytes; use it for wire-level probes such as path-traversal verification. The runner injects Host and Connection: close in raw mode unless the case provides them."
          }
        }
      }
    }
  }
}
