{
  "id": "compression-default",
  "description": "Default compression behavior: serve uses connect/compression middleware. Sends Accept-Encoding: gzip and inspects whether body is decompressed by fetch. The 'vary: Accept-Encoding' is the easy signal.",
  "fixture": {
    "files": {
      "asset.css": "body{color:red}body{color:red}body{color:red}body{color:red}body{color:red}body{color:red}body{color:red}body{color:red}body{color:red}body{color:red}body{color:red}body{color:red}\n"
    }
  },
  "requests": [
    { "name": "with_accept_encoding", "method": "GET", "path": "/asset.css", "headers": { "accept-encoding": "gzip" } }
  ]
}
